{
  "approval_ref": "state/approvals/approval-0001.json",
  "client": {
    "application_id": "airoot-cli",
    "integrity": "medium",
    "pid": 1234,
    "sid": "S-1-5-21-1000"
  },
  "operation": "commit_plan",
  "plan_ref": "state/plans/plan-0001.json",
  "protocol_version": 1,
  "request_id": "req/plan/0001"
}
